{
  "version": "1.0.0",
  "envelope": ["tenant_id", "actor_id", "profile", "track", "correlation_id", "idempotency_key", "source_node_id", "position_id"],
  "policy_order": ["inject", "tenant", "registry", "rbac", "approval", "gates", "scope", "execute", "audit"],
  "front_forbidden_nouns": ["cubejs", "graphiti", "neo4j", "langgraph", "temporal", "lethe", "workflow_id", "CubeQL"],
  "modules": [
    {"id":"M1","name":"WorkStudio","layer":"use","decision":"own-shell","replaceable":false,"protocol_id":"hub.scene.pack.open","port":null,"hub_methods":["hub.scene.pack.open","hub.scene.insight.drill","hub.scene.task.issue","hub.policy.explain"],"verbs":["open","render"],"errors":["TENANT_MISMATCH","SCOPE_DENIED"],"forbidden":["零件SDK","聊天当状态"]},
    {"id":"M2","name":"责任图","layer":"K-L0","decision":"own","replaceable":false,"protocol_id":"hub.ops.graph","port":null,"hub_methods":["hub.scene.pack.open","hub.ops.graph.get","hub.ops.graph.validate","hub.ops.graph.publish"],"verbs":["slice","validate","publish"],"errors":["WM_INCOMPLETE","SCOPE_DENIED"],"forbidden":["Graphiti当L0"]},
    {"id":"M3","name":"世界模型Store","layer":"K-L0","decision":"own","replaceable":false,"protocol_id":"hub.wm","port":null,"hub_methods":["hub.wm.get","hub.wm.patch","hub.ops.wm.get"],"verbs":["get","patch"],"errors":["INVARIANT_FAILED"],"forbidden":["live改compiled"]},
    {"id":"M4","name":"Law Pack","layer":"K-L0","decision":"own","replaceable":false,"protocol_id":"hub.law.compile","port":"LawPort","hub_methods":["hub.law.compile","hub.ops.law.diff"],"verbs":["compile","diff"],"errors":["INVARIANT_FAILED"],"forbidden":["会话内改生产知识"]},
    {"id":"M5","name":"Insight→Task","layer":"use","decision":"own","replaceable":false,"protocol_id":"hub.scene.task.issue","port":null,"hub_methods":["hub.scene.insight.drill","hub.scene.task.issue","hub.scene.task.return"],"verbs":["drill","issue","return"],"errors":["TASK_SOURCE_REQUIRED","UNGROUNDED_INSIGHT","WM_INCOMPLETE"],"forbidden":["签发即启工作流"]},
    {"id":"M6","name":"Capability Hub","layer":"control","decision":"own","replaceable":false,"protocol_id":"hub.policy","port":null,"hub_methods":["hub.policy.explain","hub.scene.invoke_cs","hub.instance.invoke_cs"],"verbs":["enforce","explain"],"errors":["PROFILE_FORBIDS_SIDE_EFFECT","THREAD_PROFILE_IMMUTABLE"],"forbidden":["第二套控制面"]},
    {"id":"M7","name":"Registry","layer":"control","decision":"own-contract","replaceable":false,"protocol_id":"cs.*","port":null,"hub_methods":["hub.ops.registry.list","hub.ops.registry.patch"],"verbs":["list","patch"],"errors":["OPERATION_NOT_FOUND"],"forbidden":["双份schema"]},
    {"id":"M8","name":"IAM","layer":"govern","decision":"own-contract","replaceable":false,"protocol_id":"hub.ops.iam","port":"IamPort","hub_methods":["hub.ops.iam.bindings"],"verbs":["bind","resolve"],"errors":["TRACK_ESCALATION_REQUIRED","SCOPE_DENIED"],"forbidden":["IdP角色当承诺权"]},
    {"id":"M9","name":"Skill","layer":"weave","decision":"own","replaceable":false,"protocol_id":"hub.skill","port":"SkillPort","hub_methods":["hub.skill.transition","hub.ops.skill.list"],"verbs":["transition"],"errors":["SKILL_NOT_EXECUTABLE_IN_PROFILE"],"forbidden":["explore执行"]},
    {"id":"M10","name":"Artifact","layer":"runtime","decision":"own","replaceable":true,"protocol_id":"hub.ops.artifact","port":"ArtifactPort","hub_methods":["hub.ops.artifact.list"],"verbs":["put","get"],"errors":["INVARIANT_FAILED"],"forbidden":["file驱动pack.open"]},
    {"id":"M11","name":"Audit","layer":"govern","decision":"own","replaceable":false,"protocol_id":"hub.ops.audit","port":null,"hub_methods":["hub.ops.audit.search","hub.ops.audit.export"],"verbs":["append","search","export"],"errors":["SCOPE_DENIED"],"forbidden":["Cube当审计"]},
    {"id":"M12","name":"Evolution","layer":"evolve","decision":"own","replaceable":false,"protocol_id":"hub.ops.changeset","port":"EvolutionPort","hub_methods":["hub.ops.changeset.list","hub.ops.changeset.submit","hub.ops.changeset.decide"],"verbs":["draft","submit","decide"],"errors":["INVARIANT_FAILED"],"forbidden":["auto_apply"]},
    {"id":"M13","name":"MCP Gateway","layer":"protocol","decision":"own-shell","replaceable":false,"protocol_id":"hub.mcp.tools","port":"McpPort","hub_methods":["hub.mcp.tools.list","hub.mcp.tools.call","hub.ops.mcp.preview"],"verbs":["list","call"],"errors":["PROFILE_FORBIDS_SIDE_EFFECT"],"forbidden":["list跳过call判定"]},
    {"id":"M14","name":"Connector","layer":"system","decision":"own-contract","replaceable":true,"protocol_id":"connector.invoke","port":"ConnectorPort","hub_methods":["hub.ops.connector.list","hub.ops.connector.rotate"],"verbs":["invoke","rotate"],"errors":["GATE_BLOCKED"],"forbidden":["密钥出进程"]},
    {"id":"M15","name":"口径Cube+OSI","layer":"K-L1","decision":"integrate","replaceable":true,"protocol_id":"cs.metric.query","port":"CubePort","hub_methods":["hub.metric.query","hub.ops.caliber.status"],"verbs":["query"],"errors":["CALIBER_MISSING"],"forbidden":["签发任务"],"part":"Cube Core","fixture":"FixtureCube"},
    {"id":"M16","name":"时态知识","layer":"K-L2","decision":"integrate","replaceable":true,"protocol_id":"hub.kg.search","port":"KgPort","hub_methods":["hub.kg.search","hub.ops.kg.search","hub.ops.kg.ingest_status"],"verbs":["search","ingest"],"errors":["UNGROUNDED_INSIGHT"],"forbidden":["cs写"],"part":"Graphiti","fixture":"FixtureKg"},
    {"id":"M17","name":"Lethe","layer":"K-L3","decision":"integrate","replaceable":true,"protocol_id":"hub.memory.self","port":"MemoryPort","hub_methods":["hub.memory.self.search","hub.ops.memory.receipt"],"verbs":["add","search","forget"],"errors":["MEMORY_TRACK_FORBIDDEN"],"forbidden":["与责任图同库"],"part":"Lethe","fixture":"FixtureMemory"},
    {"id":"M18","name":"外环Temporal","layer":"runtime","decision":"integrate","replaceable":true,"protocol_id":"hub.exec.open","port":"OuterLoopPort","hub_methods":["hub.exec.open","hub.instance.cycle_step","hub.ops.runtime.task","hub.ops.runtime.retry"],"verbs":["open","signal"],"errors":["TASK_NOT_ISSUED"],"forbidden":["Celery当寿命"],"part":"Temporal","fixture":"InMemoryOuterLoop"},
    {"id":"M19","name":"内环LangGraph","layer":"weave","decision":"integrate","replaceable":true,"protocol_id":"innerloop.turn","port":"InnerLoopPort","hub_methods":["hub.instance.cycle_step"],"verbs":["turn","interrupt"],"errors":["SCOPE_DENIED"],"forbidden":["出站CRM"],"part":"LangGraph","fixture":"FixtureInnerLoop"},
    {"id":"M20","name":"JSON Schema","layer":"protocol","decision":"own-contract","replaceable":false,"protocol_id":"hub.ops.schema.drift","port":null,"hub_methods":["hub.ops.schema.drift"],"verbs":["drift"],"errors":["INVARIANT_FAILED"],"forbidden":["双份模型"]},
    {"id":"M21","name":"转派A2A","layer":"weave","decision":"own-contract","replaceable":false,"protocol_id":"hub.task.transfer","port":null,"hub_methods":["hub.task.transfer"],"verbs":["transfer"],"errors":["TENANT_MISMATCH"],"forbidden":["P0跨租户"]},
    {"id":"M22","name":"Utopia","layer":"knowledge","decision":"optional","replaceable":true,"protocol_id":"review.export","port":"ReviewPort","hub_methods":[],"verbs":["export"],"errors":[],"forbidden":["生产写"],"fixture":null},
    {"id":"M23","name":"主数据SoR","layer":"system","decision":"connect","replaceable":true,"protocol_id":"sor.object_ref","port":null,"hub_methods":[],"verbs":["ref"],"errors":[],"forbidden":["复制主档"]},
    {"id":"M24","name":"LLM Broker","layer":"weave","decision":"connect","replaceable":true,"protocol_id":"hub.ops.model.route","port":"BrokerPort","hub_methods":["hub.ops.model.route"],"verbs":["complete","route"],"errors":["SCOPE_DENIED"],"forbidden":["聊天当状态"],"part":"Provider SDK","fixture":"FixtureBroker"}
  ]
}
